{
  "id": "python",
  "title": "Python: reading code",
  "language": "python",
  "levels": [
    {
      "level": "beginner",
      "title": "Foundations",
      "lessons": [
        {
          "id": "values-and-loops",
          "title": "Values, assignment and loops",
          "builds_on": [],
          "questions": [
            "m1-assignment-snapshot",
            "m1-even-accumulator",
            "py-remove-loop-reset"
          ]
        },
        {
          "id": "arithmetic",
          "title": "Numbers and grouping",
          "builds_on": [
            "values-and-loops"
          ],
          "questions": [
            "py-negative-floor-rounding",
            "py-arithmetic-precedence-chain"
          ]
        },
        {
          "id": "strings-and-boundaries",
          "title": "Strings, indexing and truthiness",
          "builds_on": [
            "values-and-loops"
          ],
          "questions": [
            "py-string-number-repetition",
            "py-strip-characters-not-substring",
            "py-string-prefix-source",
            "py-list-last-boundary",
            "py-nonempty-false-string"
          ]
        }
      ]
    },
    {
      "level": "intermediate",
      "title": "Reading with care",
      "lessons": [
        {
          "id": "lists-and-mutation",
          "title": "Lists and mutation",
          "builds_on": [
            "values-and-loops"
          ],
          "questions": [
            "m1-list-iadd-equivalence",
            "m1-negative-index-guard",
            "py-shallow-inner-mutation"
          ]
        },
        {
          "id": "functions-and-scope",
          "title": "Functions, defaults and closures",
          "builds_on": [
            "values-and-loops"
          ],
          "questions": [
            "py-remove-global-counter",
            "py-shared-default-ai-review",
            "py-closure-loop-readers",
            "py-and-skips-record-call",
            "py-default-none-guard-ownership",
            "py-keyword-evaluation-before-binding",
            "py-nonlocal-independent-counters"
          ]
        },
        {
          "id": "dictionary-defaults",
          "title": "Dictionaries and defaults",
          "builds_on": [
            "strings-and-boundaries",
            "functions-and-scope"
          ],
          "questions": [
            "py-dictionary-iteration-order",
            "py-dict-default-or-equivalence"
          ]
        },
        {
          "id": "comprehensions",
          "title": "Comprehension scope",
          "builds_on": [
            "functions-and-scope"
          ],
          "questions": [
            "py-comprehension-keeps-outer",
            "py-comprehension-filter-before-division"
          ]
        },
        {
          "id": "iterators",
          "title": "Iterators and cursors",
          "builds_on": [
            "functions-and-scope"
          ],
          "questions": [
            "py-iterator-cursor-ownership"
          ]
        },
        {
          "id": "modules",
          "title": "Modules and imports",
          "summary": "Read module aliases and imported names, and distinguish a new name binding from rebinding a module attribute.",
          "builds_on": [
            "functions-and-scope"
          ],
          "questions": [
            "py-import-module-and-from-binding"
          ]
        },
        {
          "id": "classes",
          "title": "Objects and classes",
          "summary": "Read ordinary instance and class attributes. Follow shared mutable data, instance shadowing, and the receiving object in a method call.",
          "builds_on": [
            "functions-and-scope",
            "lists-and-mutation"
          ],
          "questions": [
            "py-instance-shadow-and-class-list"
          ]
        },
        {
          "id": "exceptions",
          "title": "Handlers and cleanup",
          "builds_on": [
            "functions-and-scope"
          ],
          "questions": [
            "py-typed-handler-finally"
          ]
        }
      ]
    },
    {
      "level": "advanced",
      "title": "Under the hood",
      "lessons": [
        {
          "id": "generators",
          "title": "Generators and errors",
          "builds_on": [
            "functions-and-scope",
            "iterators"
          ],
          "questions": [
            "py-generator-append-consumption",
            "py-generator-error-lifecycle",
            "py-generator-send-roundtrip"
          ]
        },
        {
          "id": "complexity",
          "title": "Counting the hidden work",
          "builds_on": [
            "values-and-loops",
            "lists-and-mutation"
          ],
          "questions": [
            "py-prefix-duplicate-complexity",
            "py-geometric-halving-work",
            "py-sorted-adjacent-gap-cost"
          ]
        }
      ]
    }
  ]
}
